URL,Company,Title,Product_Description
www.jamesmadison.org/,jamesmadison,Explaining NFTs - Are NFTs a Scam?,N/A
www.fee.org/,fee,What is an NFT—and Why Are Some Worth So Much Money?,N/A
www.financestrategists.com/nft,financestrategists,Non-fungible Tokens Definition | Nft Meaning,N/A
www.lifespan.io/,lifespan,What Is an NFT and How Do NFTs Work? | Lifespan.io,N/A
try.malwarebytes.com/,malwarebytes,Malwarebytes - Official Site - Online Protection for 2024,N/A
www.norton.com/,norton,"Norton™ 360 - For PCs, Macs, iOS & Android - Malware Removal",A Leading Digital Security Software + Identity Protection. Try Now! Help Protect Your Private & Financial Information with Norton™ 360. Download Now! Over 175+ Million Users. Official Norton™ Site. Secures PCs & Macs. Instant Download. Online Sale. Money-Back Guarantee.
www.antivirusguide.com/anti-malware/mac,antivirusguide,Top 10 Best Mac Anti-Malware - Best Antivirus (Recommended),N/A
www.trustedantiviruscompare.com/anti-malware/free,trustedantiviruscompare,Top5 Free Malware Removal 2024 - Best Free Anti-Malware (2024),2024's Best Free Anti-Malware Software Review. See Who Is #1 Rated Free Malware Removal. The Top 10 Best Free Anti-Malware Review. Our Choice Of Best Free Malware Removal 2024.
www.bettercompares.com/antivirus/pc,bettercompares,Top 5 Antivirus Software 2024 - See Who We Ranked #1 in 2024,Compare Between All The Solutions of All PC Antivirus Companies. Start A Free Trial Today! Compare The Most Trusted PC Antivirus Software for 2024! Download Online The Best For You.
www.avg.com/,avg,AVG Free Antivirus 2024 - Download Free Anti-Malware,"Stops viruses, spyware, malware and ransomware with six powerful layers of protection. Free Forever - Fast & Easy Antivirus Software. Download AVG Antivirus. Scans quickly & quietly. Stops viruses. Protects forever. Unsafe web link warnings. Install in moments."
try.malwarebytes.com/,malwarebytes,Malwarebytes - Official Site,"Online Protection for 2024 — Malwarebytes Premium blocks threats like worms, trojans, rootkits, spyware, bots, & more. Stop worrying about online threats. Try Malwarebytes Premium for free for 14 days. Free Trial."
www.antivirussoftwareguide.com/,antivirussoftwareguide,Top 10 Best Free Anti-Malware | 100% Free Malware Removal,The Best Free Malware Removal Software. See Who Is Best Anti-Malware 2022. Protect Your Computer From Viruses & Malware.
www.trustedantiviruscompare.com/anti-malware/free,trustedantiviruscompare,Top5 Free Malware Removal 2024 - Best Free Anti-Malware (2024),2024's Best Free Anti-Malware Software Review. See Who Is #1 Rated Free Malware Removal. The Top 10 Best Free Anti-Malware Review.
www.norton.com/,norton,"Norton™ Antivirus Plus - For PCs, Macs, iOS & Android",A Leading Digital Security Software + Identity Protection. Try Now! Help Protect Your Private & Financial Information with Norton™ 360.
try.malwarebytes.com/,malwarebytes,Malwarebytes.com,"Malwarebytes - Official Site — Malwarebytes Premium blocks threats like worms, trojans, rootkits, spyware, bots, & more."
www.norton.com/official_site,norton,"Norton™ Antivirus Plus - For PCs, Macs, iOS & Android",N/A
www.antivirussoftwareguide.com/,antivirussoftwareguide,Top 10 Best Free Anti-Malware - 100% Free Malware Removal,N/A
www.trustedantiviruscompare.com/anti-malware/free,trustedantiviruscompare,Top5 Free Malware Removal 2024 - #1 Best Free Anti-Malware 2024,N/A
us.cybernews.com/best-antivirus,cybernews,Top 10 Best Anti-Malware Tools,Recommended (February 2024) Experience Enhanced Protection with Our Premium Antivirus Software. Be Safe From Malware! Don't Compromise on Security. Our Top-Ranked Antivirus Software Recommended by Experts.
www.antivirussoftwareguide.com/,antivirussoftwareguide,Top 10 Best Free Anti-Malware - 100% Free Malware Removal,Read our Anti-Malwre Software Reviews to Help You Find The Best Free Anti Malware 2024. Best Free Anti Malware Protection 2024. Compare Anti Malwre Providers Side-By-Side. Compare Providers. Top 10 Antivirus. Trusted Reviews. Best Prices & Deals.
try.malwarebytes.com/,malwarebytes,Malwarebytes - Official Site - Install Malwarebytes - Free,"Malwarebytes Premium blocks threats like worms, trojans, rootkits, spyware, bots, & more. Stop worrying about online threats. Try Malwarebytes Premium for free for 14 days. All Computers & Devices. 500+ Million Downloads. Free Trial. Unmatched Threat Scans. Trusted Since 2004."
www.antivirusguide.com/,antivirusguide,Top 10 Best Mac Anti-Malware - Best Antivirus (Recommended),See It On AntivirusGuide - The Trusted Source For Antivirus Reviews! Scanning & Detection. Installation & Setup. Trusted Reviews. AntiVirus Plus. Internet Security. Total Protection. Special Deals. Value For The Money. Packages & Features. Powerful Security.
www.trustedantiviruscompare.com/anti-malware/free,trustedantiviruscompare,Top5 Free Malware Removal 2024 - Best Free Anti-Malware (2024),2024's Best Free Anti-Malware Software Review. See Who Is #1 Rated Free Malware Removal. The Top 10 Best Free Anti-Malware Review. Our Choice Of Best Free Malware Removal 2024.
www.bettercompares.com/virus/protection,bettercompares,Best Free Antivirus Software - See Who We Ranked #1 in 2024,Compare Between All The Solutions of All Antivirus Companies. Start A Free Trial Today! Compare The Most Trusted Antivirus Software for 2024! Download Online The Best For You.
try.malwarebytes.com/,malwarebytes,Malwarebytes - Official Site,"Online Protection for 2024 — Malwarebytes Premium blocks threats like worms, trojans, rootkits, spyware, bots, & more."
www.antivirussoftwareguide.com/,antivirussoftwareguide,"""Top 10"" Free Malware Removal - 100% Free Malware Removal",N/A
www.norton.com/,norton,"Norton™ 360 - For PCs, Macs, iOS & Android - Spyware Removal",N/A
www.bestantivirusbrands.com/malware/protection,bestantivirusbrands,10 Best Anti Malware Sofware - We Tried Them All,N/A
www.trustedantiviruscompare.com/anti-malware/free,trustedantiviruscompare,Top5 Free Malware Removal 2024 - Best Free Anti-Malware (2024),2024's Best Free Anti-Malware Software Review. See Who Is #1 Rated Free Malware Removal. The Top 10 Best Free Anti-Malware Review.
www.10bestantivirusproviders.com/malware/antivirus,10bestantivirusproviders,10 Best Anti Malware Apps - We Tried Them All,"We Compared The Best Malware Protection Apps. Get 2024's Top Malware Protection Today! Get Protection Against All Hackers, Malware, Adware & Spyware. Secure Your Devices Today! Avoid Hacks & Threats. Keep Your Data Safe."
www.antivirusguide.com/anti-malware/mac,antivirusguide,Top 10 Best Mac Anti-Malware | Best Antivirus (Recommended),See It On AntivirusGuide - The Trusted Source For Antivirus Reviews! Scanning & Detection. Installation & Setup. Internet Security.
